{
  "id": "stm_24h_leo_twobody_001",
  "category": "stm",
  "case_version": "0.1.0",
  "generated_by": {
    "tool": "GMAT",
    "tool_version": "R2026a",
    "kernel": "de440s.bsp",
    "gravity_model": "point-mass Earth, GM = 398600.4355070226 km^3/s^2 (SPICE DE440)",
    "perturbations": "None (two-body only)",
    "integrator": "PrinceDormand78 (RK7/8), fixed step 10 s",
    "method": "Sat.OrbitSTM and the final state in EarthMJ2000Eq, turned to ICRF by the rotation between the initial state in EarthICRF and in EarthMJ2000Eq (tools/gmat_reference/make_stm_case.py of IO.Astrodynamics)",
    "date": "2026-10-19",
    "reference_frame": "ICRF"
  },
  "outputs": {
    "final_stm": [
      [
        10.215267772789288,
        -164.1037137314506,
        -147.6665642434199,
        194994.8833137017,
        52143.09299184195,
        -52563.791549783426
      ],
      [
        7.376467456017468,
        -121.41230588273397,
        -108.07063510042937,
        144368.27295312347,
        38661.327822711624,
        -38315.169905257906
      ],
      [
        0.8396289104001896,
        -22.330544506755786,
        -20.640524098990362,
        27305.557165277867,
        7797.420075382981,
        -7347.200824900059
      ],
      [
        -0.006187890034386477,
        0.1019041915539868,
        0.09159736255129129,
        -120.52167977169738,
        -32.04972338590692,
        32.065682946375674
      ],
      [
        0.00631550360373084,
        -0.11673842274688617,
        -0.10469231997999263,
        139.17095994871397,
        37.458383535740296,
        -36.384708980017706
      ],
      [
        0.008815130471999773,
        -0.1524866639551795,
        -0.13596129216688035,
        180.34714436748672,
        49.22563268729223,
        -48.421488365217066
      ]
    ],
    "final_x_km": 3366.545734682338,
    "final_y_km": -3779.147627757229,
    "final_z_km": -4956.110717630645,
    "final_vx_km_s": 6.039166999186212,
    "final_vy_km_s": 4.377193229240483,
    "final_vz_km_s": 0.7711770342023763
  }
}
